"U2c", "Scientists are looking for alternatives to curative methods for viruses. An idea has been using phages. Some are against this usage of phages as it could be harmful for the patient. Another scientist is also against phages. ", "518", "L24", "2", "user71", "2", "4", "2", "2", "0", "0", "0", "0", "2", "0", "0", "1", "1"
"U2c", "Scientists are looking for alternatives methods of virus. Some scientists are against it because it's harmful. Another is also against for it.", "519", "L24", "3", "user72", "2", "1", "2", "2", "0", "0", "0", "1", "2", "0", "0", "1", "1"
"U3c", "Bioremediation can kill contaminates in certain substances, such as soil, ground water, and surface water. Two people, one qualified and one unqualified, both disagree with the use of bioremediation. One thinks it could change the contaminate into something more toxic.", "520", "L21", "1", "user61", "2", "4", "2", "0", "0", "0", "0", "0", "1", "0", "0", "1", "1"
"F2f", "Stem cells are cells that grow indefinitely. Stem cells help fight different types of cancers. Dr. Lewis an expert in the field says they can...", "620", "L26", "3", "user78", "2", "4", "1", "0", "1", "1", "1", "1", "3", "2", "2", "2", "2"
"U3c", "Bioremediation can kill contaminantes in the soil, ground water, and _______. One person who is qualified, and one person who is not, oppose their use.  They say that this may worsen the contaminantes.", "521", "L21", "3", "user63", "2", "4", "2", "0", "0", "0", "0", "0", "1", "0", "0", "0", "1"
"U3c", "Bioremediation can kill contaminantes in soil, groundwater, and _______. One person who is qualified, and one person who is not qualified, oppose their use. They believe that it could change the contaminante into something worse.", "522", "L21", "2", "user62", "2", "4", "2", "0", "0", "0", "0", "0", "1", "0", "0", "0", "1"
"U3c", "bioremediation helps decontaminate soil. there are two doctors views, one an expert and one not, both oppose the practice. they oppose it because of the potential harms and the lack of control. ", "524", "M22", "2", "user65", "2", "4", "2", "0", "0", "0", "0", "0", "1", "0", "0", "0", "0"
"U3c", "bioremediation helps decontaminate soil. there are two doctors opinions, one an expert and one not. both oppose this due to lack of controls", "525", "M22", "3", "user66", "2", "4", "2", "0", "0", "0", "0", "1", "1", "0", "0", "0", "1"
"U3c", "Bioremediation is the process of cleaning contamination and waste. It can clean contaminated soil, ground water, or surfaces of water. Bioremediation works by having microbes clean up the contamination by eating the waste. Dr. Harris, a microbiologist, warns against bioremediation, saying that it may turn substances into a toxic by-product.", "526", "M23", "1", "user67", "2", "4", "1", "2", "0", "0", "0", "0", "3", "2", "2", "2", "2"
"U3c", "bioremediation is the process of cleaning contamination and waste. it can clean soil, water, and waste.", "527", "M23", "3", "user69", "2", "4", "0", "3", "2", "2", "2", "2", "3", "2", "2", "2", "2"
"U3c", " bioremediation is the process of cleaning contamination and waste. it can clean soil, water and waste. ", "528", "M23", "2", "user68", "2", "4", "0", "3", "2", "2", "2", "2", "3", "2", "2", "2", "2"
"U3c", "Biomediation is a process of entering microbes into soil, water and some othe sources, which would result in cleaning the dirt in it. The microbes would use the dirts as a food source, so would consume it and grow. An expert in this area is opposing this method, due to his concern that such dirts might become a hazard themselves and the by-products they produce might be dangerous. Another scientist who is not an expert in this area is also against this method.", "529", "L24", "1", "user70", "2", "1", "2", "0", "0", "0", "0", "1", "1", "0", "0", "1", "1"
"U3c", "Biomediation is entering microbes into soil and then allowing it to grow. Some want to use this to allow it to grow and produce in soil. Scientists are against this method due to possible hazards of the byproducts. Other non-scientists are also against the method. ", "530", "L24", "2", "user71", "2", "1", "2", "0", "0", "0", "0", "0", "1", "0", "0", "1", "1"
"U3c", "Biomediation are in microbio...
Some want to use it into soil to increase the production and 
Some scientists are against it because it will produce hazard bioproducts. 
Other non-scientists are also against it. ", "531", "L24", "3", "user72", "2", "1", "2", "0", "0", "0", "0", "0", "1", "0", "0", "1", "1"
"F1d", "GMOs are genetically modified organisms. A doctor opposes thom because they could harm other crops. A virololigst supports them because they could help end the world hunger problem", "533", "M21", "3", "user63", "2", "2", "2", "2", "0", "0", "0", "1", "2", "0", "0", "0", "0"
"F1d", "GMOs are genetically modified organisms. A crop expert opposes ot because it could harm other crops. A virololigst supports them because they could end the world food shortage problem", "534", "M21", "2", "user62", "2", "2", "2", "0", "0", "0", "0", "1", "2", "0", "0", "0", "0"
"F1d", "Genetically modified organisms (GMOs) are used to create things that would not happen naturally. It uses bacterias, genetics, etc. One doctor, who is an expert, thinks it is harmful becasue it impacts biodiversity. Another doctor, who is not an expert, thinks it is the cure for world hunger.", "536", "L22", "2", "user65", "2", "4", "2", "0", "0", "0", "0", "0", "1", "0", "0", "0", "0"
"F1d", "Genetically modified organisms (GMOs) are organisms that are not created naturally. It uses bacteria, genetics, etc. An expert believes that it is harmful because it impacts biodiversity, while someone who is not an expert supports it because he thinks it's the cure to world hunger.", "537", "L22", "3", "user66", "2", "4", "2", "0", "0", "0", "0", "0", "1", "0", "0", "0", "0"
"F1d", "Genetically modified organisms, or GMO's, are organisms in which their genetic data is modified or inserted with other genetic material in order to produce an ideal trait. This genetic material can come from plants, animals, or insects. Many researchers worry that GMO's will result in low levels of biodiversity in the ecosystem. Dr. Hall, a researcher on GMO's, states that this GMO's will lay a major role in argiculture.", "538", "L23", "1", "user67", "2", "4", "2", "2", "0", "0", "0", "0", "0", "0", "0", "0", "1"
"F1d", "Genetically modiefied organamisms, or GMO's, are organaims in which thier DNA is modified and inserted in other organisms .", "540", "L23", "2", "user68", "2", "1", "0", "3", "2", "2", "2", "2", "3", "2", "2", "2", "2"
"F2d", "Stem cells are cells that can recreate and mimic other cells in the body. Dr. King, a stem cell researcher, opposes the use of stem cells because they can cause tumors in the brain and other parts of the body. Dr. Harris, a chemist and non-stem cell researcher, supports the use of stem cells.", "551", "L23", "3", "user69", "2", "1", "2", "0", "0", "0", "0", "0", "1", "0", "0", "0", "0"
"F2d", "A stem cell is a cell that has the ability to recreate and mimic a cell in the body. Dr. King, a stem cell researcher, opposes the use of stem cells because they can cause tumors in the brain and other parts of the body. Dr. Harris, a chemist and non-stem cell researcher, promotes the use of stem cells", "552", "L23", "2", "user68", "2", "4", "2", "0", "0", "0", "0", "0", "1", "0", "0", "1", "1"
"F1d", "geneticali modified organizems are the organizms whose genes have been genetically modified by humans. Bacteria, viruses and other microbes are the centre of attention involved in creating the genome. Dr. Lewis insists that such genome modification results in a reduction in biodiversity, so he is against it. while, a proffesor who is not proffesionally educated in GM studies, clawins that these modifications are necessary for providing food source for people.", "541", "M24", "1", "user70", "2", "1", "2", "0", "0", "0", "0", "0", "1", "0", "0", "0", "0"
"F1d", "
GMO are geneticallt modified plants, animals, crops, etc. scientists study these. good; potentially increase food crop yield
bad: is that it decreases biodiversity", "542", "M24", "2", "user71", "2", "2", "0", "3", "2", "2", "2", "2", "3", "2", "2", "2", "2"
"F1d", "GMO     modifies plants, animals, crops, etc. Scientists are studying these.
good: increase the crop delivery
bad: decrease the biocrapy", "543", "M24", "3", "user72", "2", "1", "0", "3", "2", "2", "2", "2", "3", "2", "2", "2", "2"
"F2f", "stem cells can replicate themselves and be used to repair damaged cells in the body. geneticists believe in the use of stem cells. even those who aren't experts believe in it. ", "618", "M25", "3", "user75", "2", "4", "2", "0", "0", "0", "1", "1", "1", "0", "0", "1", "1"
"F2d", "stem cells are generic cells that can make copies of themselves indefinitly. they can be reproduced in heart tissue, brain tissue, etc. one dr. opposes the use of stem cells. another non expert supports this use because it could cure cancer.", "544", "M21", "1", "user61", "2", "4", "2", "0", "0", "0", "1", "1", "1", "0", "0", "0", "1"
"F2d", "stem cells are generic cells that can copy themselves indefinitvly. some doctor opposes them, but i dont know why and someone who is qualified supports them", "545", "M21", "3", "user63", "2", "4", "2", "2", "0", "0", "1", "1", "0", "0", "0", "1", "1"
"F2d", "stem cells are generic cell that can make copies of themselves infinitivly. one doctor opposes them, but i dont know why and another person who is qualified supports them because they could cure cancer", "546", "M21", "2", "user62", "2", "4", "2", "2", "0", "0", "1", "1", "0", "0", "0", "0", "1"
"F2d", "Stem cells are a controversial topic. They can be used in medical cases such as heart conditions. The cells reproduce many times. Dr. King, an expert, opposes the use of stem cells because of the risk of tumors. Dr. Harris (?), who is not an expert, thinks it is a great idea. Especially in the research of tumors.", "548", "L22", "2", "user65", "2", "4", "2", "0", "0", "0", "0", "0", "1", "0", "0", "0", "1"
"F2d", "Stem cells are useful medically, such as in the treatment of heart conditions. They reproduce many times. Dr. King, an expert, is against their use due to the risk of tumors. Dr. Harris (?), who is not an expert, supports it because it can be used widely in research, especially in cancer.", "549", "L22", "3", "user66", "2", "4", "2", "0", "0", "0", "0", "0", "1", "0", "0", "0", "0"
"F2d", "A stem cell is a cell that has the ability to replicate a cell in the body and mimic their functions. According to Dr. King, a stem cell researcher, he opposes the use of stem cells because they may cause tumors in the brain and other areas of the body. On the other hand, Dr. Harris, a chemist and a non-stem specialist, supports the use of stem cells because of their ability to aid in the growth of medicine.", "550", "L23", "1", "user67", "2", "4", "2", "0", "0", "0", "0", "0", "1", "0", "0", "0", "0"
"F2d", "stem cells are used because they differentiate into different tissuees like heart, lung , etc cells. a pro is that non expert chemists says they can be used for making different cells. a con is that they can possibly be made into tumors when handled inappropriately ", "554", "M24", "2", "user71", "2", "4", "1", "1", "0", "1", "0", "1", "3", "2", "2", "2", "2"
"F2d", "stem cells are used in many ways because they can differciate into many tissues: heart, lungs, etc cells
pro: non scientists say that they can be used into different cells
cons: they are used ", "555", "M24", "3", "user72", "2", "1", "1", "1", "0", "1", "0", "1", "3", "2", "2", "2", "2"
"F3d", "mumps is a disease caused by a virus. the mmr vacine is for measles, mumps, and rubella. it's given in two shots. one at age one and another at age 4. one qualifies dr. opposes this vaccine . an ecologist's opinion is for some reason included, and he supports the use of this vaccine.", "556", "M21", "1", "user61", "2", "4", "2", "0", "0", "0", "1", "1", "2", "0", "0", "1", "1"
"F3d", "mumps is a virus caused by a viral infection. a vacine called mmr vacine protects againts it. its administered in two doses. one shot and another 4 years later. dr someone opposes it, and an erologist (i dont know why hes included) opposes it as well", "558", "M21", "2", "user62", "2", "4", "2", "2", "0", "0", "1", "1", "2", "0", "1", "1", "1"
"F3d", "Mumps, a dangerous illness, can be prevented with the MMR vaccine. It is administered twice, once at 1 year and next at 4 years of age. One Doctor, an expert in the field, feels that the risks outweigh the benefits. Due to the high risk of things like allergic reactions. Another doctor, who is not an expert, thinks it should be done to protect everyone from the diesease.", "560", "L22", "2", "user65", "2", "4", "2", "0", "0", "0", "0", "0", "1", "0", "0", "0", "0"
"F3d", "Mumps, a dangerous illness, can be prevented by the MMR vaccine, which is given at 1 year and 4 years of age. One doctor, an expert in the field, believes the risks, such as allergic reactions, outweigh the benefits. Another doctor, who is not an expert, believes it is beneficial to prevent people from getting the disease.", "561", "L22", "3", "user66", "2", "4", "2", "0", "0", "0", "0", "0", "1", "0", "0", "0", "0"
"F3d", "Mumps is a contageous disease spread by a virus. The vaccination for mumps is MMR, and it consists of three shots for measles, mumps, and rubella. A child is given the shot twice when they are one and four years old. Dr. White, a virologist,  is against MMR shots, because he states that they can produce allergic reactions that may be more dangerous than mumps itself. Another researcher, an ecologist and nonspecialist, states that the vaccine is safe and prevents against dangerous disease in young children.", "562", "L23", "1", "user67", "2", "4", "2", "0", "0", "0", "0", "0", "1", "0", "0", "0", "0"
"F3d", "Mumps is a disease that is vaccinated for with the MMR vaccine. MMR contains mumps, measles, and rubella. Children are vaccinated at one and four years old. Dr. White thinks that MMR can cause more harm than good. Another Dr thinks that MMR prevents harmful diseases.", "563", "L23", "3", "user69", "2", "4", "2", "2", "0", "0", "0", "0", "2", "0", "0", "0", "0"
"F3d", "Mumps is a contagious virus that is vaccinated for with the shot MMR. The vaccine contains mumps, measles and rubella. The vaccine is given to children when they are one and four years old. Dr. White, a viologist, is against the MMR vaccine because he thinks it can cause more harm than mumps itself. Another Dr. says the vaccine is fine and protects children from more harmful diseases.", "564", "L23", "2", "user68", "2", "4", "2", "2", "0", "0", "0", "0", "2", "0", "0", "0", "0"
"F3d", "there is a vaccine for Mumps, called MMR. this vaccine would provide vaccination against other diseases as well. Dr. white who is educated in this area is against the use of this vaccine,because its dangers are more than its benefits. Another doctor who is an oncologist claims that this vaccine should be used. the vaccine should be provided in two doses to children at the age of one and four.", "565", "M24", "1", "user70", "2", "4", "2", "0", "0", "0", "0", "0", "2", "0", "0", "1", "1"
"F3d", "MMR is a vacine for mamine and rub.. for children aged of 1-4.
viruists are against it because its  damages>benefits
ecologists are for it because it's useful.", "566", "M24", "3", "user72", "2", "1", "2", "2", "0", "0", "0", "0", "2", "0", "0", "0", "1"
"F3d", "MMR is a vaccine against measles mumps and rubella given at ages 1 and 4. 
virulists are against it because risks>benefits
ecologists are for it because it is helpful.", "567", "M24", "2", "user71", "2", "4", "2", "2", "0", "0", "0", "0", "2", "0", "0", "0", "1"
"U1e", " Thorium has been proposed as an alternative to uranium.  Experts feel it is much safer than uranium.  Some people with less familiarity with the subject think otherwise.", "568", "L25", "1", "user73", "2", "4", "2", "0", "0", "0", "0", "0", "1", "0", "0", "1", "1"
"U1e", "Thorium has been proposed as an alternative to uranium.  Some experts say it is much safer than uraniam.  Some people who aren't very familiar with this yet might think otherwise.  ", "569", "L25", "2", "user74", "2", "4", "2", "0", "0", "0", "0", "0", "1", "0", "0", "1", "1"
"U1e", "Thorium has been proposed as an alternative to uranium. Experts say it is much better than uranium. Some people who might not know much about it yet might think otherwise. ", "570", "L25", "3", "user75", "2", "4", "2", "0", "0", "0", "0", "1", "1", "0", "0", "1", "1"
"U1e", "thorium, a new element on the periodic table, threatens to overtake uranium for its many uses. uranium loses more harmful neutrons to the atmosphere than does thorium. this is cited as thorium greatest advantage. dr williamson disagrees however. dr williamson is not an expert in this field.", "571", "M26", "1", "user76", "2", "4", "1", "1", "0", "1", "1", "1", "3", "2", "2", "2", "2"
"U1e", "thorium is a new type of element on the periodic table. it overtakes uranium in many ways, one being that uranium loses more neutrons to the universe. this is the greatest benefit about thorium. dr williamson agrees but he is not an expert in the field.", "572", "M26", "2", "user77", "2", "1", "1", "1", "0", "0", "0", "1", "3", "2", "2", "2", "2"
"U1e", "thorium is a new element on the periodic table of elements. it overtakes uranium in many ways, one being that uranium takes neutrons from the universe. dr. williamson agrees but is not an expert in this field. ", "573", "M26", "3", "user78", "2", "1", "1", "1", "0", "0", "0", "1", "3", "2", "2", "2", "2"
"U1e", "research is being done on a new element called thorium. it could possibly replace uranium in the nuclear world. Some scientists say that it is a safer alternative to uranium. whereas others say it could cause leakage in the nuclear reactor.", "574", "M27", "2", "user80", "2", "4", "2", "2", "0", "0", "0", "0", "2", "0", "0", "0", "0"
"U1e", "there is currently being done new research on an element called thorium which could replace uranium in the nuclear world. one expert says that is a safe alternative to uranium, while others say that there is an increased risk of leakage in the reactor ", "575", "M27", "1", "user79", "2", "4", "2", "0", "0", "0", "0", "0", "2", "0", "0", "0", "0"
"U1e", "There is research being done on thorium, a nuclear element that may be able to replace uranium. One expert says that this is good, another non-expert says this is bad.", "579", "L28", "3", "user84", "2", "4", "2", "0", "0", "0", "1", "1", "1", "0", "0", "1", "1"
"U2e", "Some infections have become immune to antibiotics.   Phage therapy used in Europe is an alternative to antibiotics.  Some scientists want to bring it to the United States but others are opposed.", "580", "L25", "1", "user73", "2", "4", "2", "2", "0", "0", "1", "1", "2", "0", "0", "1", "1"
"U2e", "Some infections have become immune to antibiotics.  Phage therapy is used in Europe as an alternative to antibiotics.  Some scientists want to bring it to the US, but others are opposed.", "581", "L25", "2", "user74", "2", "4", "2", "2", "0", "0", "1", "1", "2", "0", "0", "1", "1"
"U2e", "Some diseases have become immune to antibiotics. Phage therapy is being used in Europe as an alternative to antibiotics. Some scientists in the United States are interested in using the therapy while others are opposed.", "582", "L25", "3", "user75", "2", "4", "2", "2", "0", "0", "1", "1", "2", "0", "0", "1", "1"
"U2e", "antibiotics are being overused. it creates antibiotic resistance. one doctor says that phage therapy will help this issue. phage therapy is.... dr. wilson opposes the idea of phage therapy. ", "584", "M26", "2", "user77", "2", "4", "2", "2", "0", "0", "1", "1", "2", "0", "0", "1", "1"
"U2e", "antibiotics are being overused. this is causing antibiotic resistance. it is thought that phage theory will help. phage theory is... dr. wilson opposes the phage theory. 
", "585", "M26", "3", "user78", "2", "4", "1", "2", "0", "1", "1", "1", "3", "2", "2", "2", "2"
"U2e", "antibiotics is one of the causes that has led to bacterial resistance.", "586", "M27", "2", "user80", "2", "0", "0", "3", "2", "2", "2", "2", "3", "2", "2", "2", "2"
"U2e", "antibitoics is one of the causes that has led to bacterial resistance
l", "587", "M27", "1", "user79", "2", "0", "0", "3", "2", "2", "2", "2", "3", "2", "2", "2", "2"
"U2e", "antibiotics is one of the causes that has led to bacterial resistance.", "588", "M27", "3", "user81", "2", "0", "0", "3", "2", "2", "2", "2", "3", "2", "2", "2", "2"
"U2e", "Since some infectious diseases hvae become resistnat to atibiotics a new way to combat them has been introduced. The new was to combat them is through phages. Some support the use of phages because they can reduce the number of infectious diseases. Others oppose phages because there is risk that they will mutate into other infectious diseases.", "589", "L28", "3", "user84", "2", "4", "2", "2", "0", "0", "0", "1", "2", "0", "0", "0", "1"
"U2e", "Since some infections have become resistant to antibiotics a new way of combatting them has been introduced. The new was to combat them is to use phages. Some say using phages is a god idea as it has been used for a long time in Eastern Europe. Others oppose because phages could possibly mutate into other more infectious diseases.", "590", "L28", "2", "user83", "2", "4", "2", "2", "0", "0", "0", "0", "2", "0", "0", "0", "1"
"F2h", "Stem cells duplicate cells in your body, creating more and more of them. A doctor is opposed to stem cells because they could duplicate cells that are bad for your body, such as tumor calls", "693", "L30", "3", "user90", "2", "4", "1", "2", "0", "0", "0", "0", "3", "2", "2", "2", "2"
"U2e", "Since some infections have become resistant to antibiotics, a new process has been suggested to combat infections. This process uses phages to combat infections. One expert in the field says that this is a good way to fight infections, as it has been used in Eastern Europe for a long time. Another physician and non-expert in infections says that phages are not a good idea because some phages have the possibility of mutating into harmful infectious diseases.", "591", "L28", "1", "user82", "2", "4", "2", "0", "0", "0", "0", "0", "1", "0", "0", "0", "1"
"U3e", "Biomedradiation removes toxic wastes from natural substances.  Some chemists agree with it - some disagree.", "592", "L25", "1", "user73", "2", "4", "2", "2", "0", "0", "1", "1", "2", "0", "0", "1", "1"
"U3e", "Biomedration removes toxic waste from natural substances.  Some chemists agree with it- some disagree.  ", "593", "L25", "2", "user74", "2", "4", "2", "2", "0", "0", "1", "1", "2", "0", "0", "1", "1"
"U3e", "Biomedration removes toxic waste from some substances. Some scientists agree with it- some do not. ", "594", "L25", "3", "user75", "2", "4", "2", "2", "0", "0", "1", "1", "2", "0", "0", "1", "1"
"U3e", "bioremediation is a science that may be useful in fighting harmful bacteria in the ground and rain water. bioremediation uses naturally occuring, non-harmful species of bacteria that feed on the harmful bacteria, rendering the ground water essentially clean without the use of chemicals. this is purported as bioremediations greatest benefit. however, there are some scientists who are against bioremediation, such as dr harris, although he is not considered an expert in this field.", "595", "M26", "1", "user76", "2", "4", "1", "1", "0", "1", "1", "1", "3", "2", "2", "2", "2"
"U3e", "bioremediation is a process that gets rid of harmful bacteria. it latches onto harmful bacteria and feeds off of them. 
", "596", "M26", "2", "user77", "2", "1", "0", "3", "2", "2", "2", "2", "3", "2", "2", "2", "2"
"U3e", "bioremeditation is a process that gets rid of harmful bacteria. it latches onto harmful bacteria and feeds off of them. ", "597", "M26", "3", "user78", "2", "1", "0", "3", "2", "2", "2", "2", "3", "2", "2", "2", "2"
"U3e", "bioremediation can turn contaminated waste into useful product. opposers of bioremediation say it could possibly be a toxic waste product.", "598", "M27", "2", "user80", "2", "1", "2", "2", "0", "1", "0", "1", "2", "0", "0", "0", "0"
"U3e", "bioremediation turns contamind waste into usable products. 
Opposers of bioremediation say it could potentially be a toxic waste product.", "599", "M27", "1", "user79", "2", "1", "2", "2", "0", "1", "0", "1", "2", "0", "0", "0", "0"
"U3e", "bioremediation can turn contamimated waste into useful product. opposers say that bioremediation can produce toxic waste product.", "600", "M27", "3", "user81", "2", "1", "2", "2", "0", "1", "0", "1", "2", "0", "0", "0", "0"
"U3e", "Bioremediation is a process in which toxins are removed from soil and other materials. One expert says this is a worthy process. Another person says this may lead to more toxins being released through the process of bioremediation itself.", "601", "L28", "2", "user83", "2", "4", "2", "0", "0", "0", "1", "1", "2", "0", "0", "0", "0"
"U3e", "Bioremediation is a process that removes toxins from soil and other materials. One expert says that this is a worthy process. Another person says that this may lead to addition toxins released in the environment from the bioremediation itself.", "602", "L28", "1", "user82", "2", "4", "2", "0", "0", "0", "1", "1", "2", "0", "0", "0", "0"
"F1f", "gmos are genetically modified organisms that can help produce healthy plants and crops. dr lewis, a geneticist, believes in the use of gmos. dr hall, not an expert in the field also supports the use of gmos.", "606", "M25", "3", "user75", "2", "1", "2", "0", "0", "0", "1", "1", "1", "0", "0", "1", "1"
